<?xml version="1.0" encoding="UTF-8"?>
<module xmlns:xsi="http://www.w3.org/2001/XMLSchema-instance"
        xsi:schemaLocation="http://www.arhor.by/sql-module ./../sql-module.xsd"
        xmlns="http://www.arhor.by/sql-module"
        name="createNewUser">

    <dependencies>
        <dependency name="roles"/>
        <dependency name="langs"/>
        <dependency name="users"/>
        <dependency name="getDefaultRole"/>
        <dependency name="getDefaultLang"/>
    </dependencies>

    <queries context="university">
        <drop target="procedure">
            <![CDATA[
            IF (OBJECT_ID('createNewUser') IS NOT NULL)
            BEGIN
                DROP PROCEDURE createNewUser
            END
            ]]>
        </drop>

        <create target="procedure">
             <![CDATA[
             CREATE PROCEDURE dbo.createNewUser
                 @email         NVARCHAR(255),
                 @password      NVARCHAR(512),
                 @first_name    NVARCHAR(50),
                 @last_name     NVARCHAR(50),
                 @role_id       BIGINT,
                 @lang_id       BIGINT
             AS
             BEGIN
                 DECLARE @default_role_id BIGINT
                 DECLARE @default_lang_id BIGINT

                 EXECUTE @default_role_id = dbo.getDefaultRole;
                 EXECUTE @default_lang_id = dbo.getDefaultLang;

                 INSERT INTO users
                 (
                    email,
                    password,
                    first_name,
                    last_name,
                    role_id,
                    lang_id
                 )
                 VALUES
                 (
                     @email,
                     @password,
                     @first_name,
                     @last_name,
                     COALESCE(@role_id, @default_role_id),
                     COALESCE(@lang_id, @default_lang_id)
                 )

                 SELECT u.id
                      , u.email
                      , u.password
                      , u.first_name
                      , u.last_name
                      , u.role_id
                      , u.lang_id
                 FROM users u WITH(NOLOCK)
                 WHERE u.email = @email
             END
             ]]>
        </create>
    </queries>

</module>